[
  {
    "candidate_id": "CAND-DBIR-001",
    "source_id": "SRC-VERIZON-DBIR-2026",
    "file_source": "SRC-VERIZON-DBIR-2026.md",
    "statement": "En el conjunto 2026 del DBIR, la explotación de vulnerabilidades fue el vector inicial más frecuente y alcanzó el 31% de las brechas.",
    "proposed_epistemic_status": "supported",
    "proposed_confidence": "high",
    "scope": "conjunto global agregado del DBIR 2026 y definiciones VERIS; no prevalencia universal.",
    "promotion_target": "`claims_human_factor.md`",
    "proposed_target_file": "claims_human_factor.md",
    "proposed_target_matrix_id": "CLM-MATRIX-HF",
    "reading_basis": "full_text_reviewed",
    "evidence_locator": null,
    "triage_status": "pending",
    "target_claim_id": null,
    "decision_reason": null,
    "decided_by_humans": [],
    "decision_date": null
  },
  {
    "candidate_id": "CAND-DBIR-002",
    "source_id": "SRC-VERIZON-DBIR-2026",
    "file_source": "SRC-VERIZON-DBIR-2026.md",
    "statement": "En las simulaciones analizadas por el DBIR 2026, las entradas móviles registraron una mediana de clics exitosos 40% superior a las entradas por correo.",
    "proposed_epistemic_status": "supported",
    "proposed_confidence": "medium",
    "scope": "conjunto de simulaciones y medición reportados; requiere conservar denominador y canal.",
    "promotion_target": "`claims_genai_social_engineering.md`",
    "proposed_target_file": "claims_genai_social_engineering.md",
    "proposed_target_matrix_id": "CLM-MATRIX-GENAI-SE",
    "reading_basis": "full_text_reviewed",
    "evidence_locator": null,
    "triage_status": "pending",
    "target_claim_id": null,
    "decision_reason": null,
    "decided_by_humans": [],
    "decision_date": null
  },
  {
    "candidate_id": "CAND-DBIR-003",
    "source_id": "SRC-VERIZON-DBIR-2026",
    "file_source": "SRC-VERIZON-DBIR-2026.md",
    "statement": "Los datos del DBIR respaldan tratar las brechas como resultados sociotécnicos con factores técnicos, humanos y organizacionales solapados.",
    "proposed_epistemic_status": "supported",
    "proposed_confidence": "medium",
    "scope": "inferencia de síntesis para diseño; no estimación causal.",
    "promotion_target": "`claims_human_factor.md`",
    "proposed_target_file": "claims_human_factor.md",
    "proposed_target_matrix_id": "CLM-MATRIX-HF",
    "reading_basis": "full_text_reviewed",
    "evidence_locator": null,
    "triage_status": "pending",
    "target_claim_id": null,
    "decision_reason": null,
    "decided_by_humans": [],
    "decision_date": null
  },
  {
    "candidate_id": "CAND-KAHNEMAN-001",
    "source_id": "SRC-KAHNEMAN-2011",
    "file_source": "SRC-KAHNEMAN-2011.md",
    "statement": "La distinción rápido/automático versus lento/deliberativo es un recurso pedagógico para describir familias de procesos, no una partición anatómica literal.",
    "proposed_epistemic_status": "supported",
    "proposed_confidence": "high",
    "scope": "uso conceptual y formativo; la evidencia de cada fenómeno requiere fuente primaria.",
    "promotion_target": "`claims_attention_decision.md`",
    "proposed_target_file": "claims_attention_decision.md",
    "proposed_target_matrix_id": "CLM-MATRIX-ATT-DEC",
    "reading_basis": "abstract_reviewed",
    "evidence_locator": null,
    "triage_status": "pending",
    "target_claim_id": null,
    "decision_reason": null,
    "decided_by_humans": [],
    "decision_date": null
  },
  {
    "candidate_id": "CAND-KAHNEMAN-002",
    "source_id": "SRC-KAHNEMAN-2011",
    "file_source": "SRC-KAHNEMAN-2011.md",
    "statement": "La confianza subjetiva no debe tratarse como prueba suficiente de exactitud decisional.",
    "proposed_epistemic_status": "established",
    "proposed_confidence": "high",
    "scope": "principio general de juicio; especificar tarea y evidencia al cuantificarlo.",
    "promotion_target": "`claims_attention_decision.md`",
    "proposed_target_file": "claims_attention_decision.md",
    "proposed_target_matrix_id": "CLM-MATRIX-ATT-DEC",
    "reading_basis": "abstract_reviewed",
    "evidence_locator": null,
    "triage_status": "pending",
    "target_claim_id": null,
    "decision_reason": null,
    "decided_by_humans": [],
    "decision_date": null
  },
  {
    "candidate_id": "CAND-KAHNEMAN-003",
    "source_id": "SRC-KAHNEMAN-2011",
    "file_source": "SRC-KAHNEMAN-2011.md",
    "statement": "Un entrenamiento responsable debe enseñar cuándo revisar una intuición y cuándo la experiencia válida puede hacerla útil, evitando el mandato universal de “pensar lento”.",
    "proposed_epistemic_status": "provisional",
    "proposed_confidence": "medium",
    "scope": "implicación pedagógica del framework, pendiente de evaluación comparativa.",
    "promotion_target": "`claims_training_learning.md`",
    "proposed_target_file": "claims_training_learning.md",
    "proposed_target_matrix_id": "CLM-MATRIX-TRAINING",
    "reading_basis": "abstract_reviewed",
    "evidence_locator": null,
    "triage_status": "pending",
    "target_claim_id": null,
    "decision_reason": null,
    "decided_by_humans": [],
    "decision_date": null
  },
  {
    "candidate_id": "CAND-ROGERS-001",
    "source_id": "SRC-ROGERS-1975",
    "file_source": "SRC-ROGERS-1975.md",
    "statement": "En la formulación de Rogers de 1975, gravedad, probabilidad de ocurrencia y eficacia de la respuesta son componentes distintos de la evaluación protectora.",
    "proposed_epistemic_status": "established",
    "proposed_confidence": "high",
    "scope": "contenido de la teoría original, no magnitud de efectos en ciberseguridad.",
    "promotion_target": "`claims_human_factor.md`",
    "proposed_target_file": "claims_human_factor.md",
    "proposed_target_matrix_id": "CLM-MATRIX-HF",
    "reading_basis": "abstract_reviewed",
    "evidence_locator": null,
    "triage_status": "pending",
    "target_claim_id": null,
    "decision_reason": null,
    "decided_by_humans": [],
    "decision_date": null
  },
  {
    "candidate_id": "CAND-ROGERS-002",
    "source_id": "SRC-ROGERS-1975",
    "file_source": "SRC-ROGERS-1975.md",
    "statement": "La fuente de 1975 no basta para afirmar que la autoeficacia formaba parte de la formulación original de PMT.",
    "proposed_epistemic_status": "established",
    "proposed_confidence": "high",
    "scope": "historia conceptual y atribución bibliográfica.",
    "promotion_target": "`claims_human_factor.md`",
    "proposed_target_file": "claims_human_factor.md",
    "proposed_target_matrix_id": "CLM-MATRIX-HF",
    "reading_basis": "abstract_reviewed",
    "evidence_locator": null,
    "triage_status": "pending",
    "target_claim_id": null,
    "decision_reason": null,
    "decided_by_humans": [],
    "decision_date": null
  },
  {
    "candidate_id": "CAND-ROGERS-003",
    "source_id": "SRC-ROGERS-1975",
    "file_source": "SRC-ROGERS-1975.md",
    "statement": "Los mensajes de amenaza deben acompañarse de respuestas eficaces y ejecutables; su efecto formativo en este framework continúa siendo una hipótesis.",
    "proposed_epistemic_status": "provisional",
    "proposed_confidence": "medium",
    "scope": "principio de diseño extrapolado a entrenamiento, pendiente de evidencia propia.",
    "promotion_target": "`claims_training_learning.md`",
    "proposed_target_file": "claims_training_learning.md",
    "proposed_target_matrix_id": "CLM-MATRIX-TRAINING",
    "reading_basis": "abstract_reviewed",
    "evidence_locator": null,
    "triage_status": "pending",
    "target_claim_id": null,
    "decision_reason": null,
    "decided_by_humans": [],
    "decision_date": null
  },
  {
    "candidate_id": "CAND-VAFA-001",
    "source_id": "SRC-VAFA-2026",
    "file_source": "SRC-VAFA-2026.md",
    "statement": "En un pipeline experimental con 200 perfiles públicos, cinco LLM generaron 17.916 correos contextuales y transfirieron habitualmente 1–2 pistas específicas del usuario a relatos con numerosas entidades adicionales fabricadas.",
    "proposed_epistemic_status": "supported",
    "proposed_confidence": "medium",
    "scope": "Instagram público, modelos y prompts del estudio; preprint v1.",
    "promotion_target": "`claims_genai_social_engineering.md`",
    "proposed_target_file": "claims_genai_social_engineering.md",
    "proposed_target_matrix_id": "CLM-MATRIX-GENAI-SE",
    "reading_basis": "full_text_reviewed",
    "evidence_locator": null,
    "triage_status": "pending",
    "target_claim_id": null,
    "decision_reason": null,
    "decided_by_humans": [],
    "decision_date": null
  },
  {
    "candidate_id": "CAND-VAFA-002",
    "source_id": "SRC-VAFA-2026",
    "file_source": "SRC-VAFA-2026.md",
    "statement": "En el estudio con 70 participantes, los correos LLM seleccionados recibieron menor sospecha media que los correos APWG seleccionados (2,75 vs. 4,44).",
    "proposed_epistemic_status": "supported",
    "proposed_confidence": "medium",
    "scope": "percepción en capturas estáticas; no conducta real de clic.",
    "promotion_target": "`claims_genai_social_engineering.md`",
    "proposed_target_file": "claims_genai_social_engineering.md",
    "proposed_target_matrix_id": "CLM-MATRIX-GENAI-SE",
    "reading_basis": "full_text_reviewed",
    "evidence_locator": null,
    "triage_status": "pending",
    "target_claim_id": null,
    "decision_reason": null,
    "decided_by_humans": [],
    "decision_date": null
  },
  {
    "candidate_id": "CAND-VAFA-003",
    "source_id": "SRC-VAFA-2026",
    "file_source": "SRC-VAFA-2026.md",
    "statement": "La evidencia pública puede bastar para anclar una representación funcional persuasiva aunque gran parte del contenido generado sea inferido o falso.",
    "proposed_epistemic_status": "supported",
    "proposed_confidence": "medium",
    "scope": "mecanismo demostrado en la canalización; requiere replicación externa.",
    "promotion_target": "`claims_genai_social_engineering.md`",
    "proposed_target_file": "claims_genai_social_engineering.md",